<?xml version="1.0" encoding="UTF-8"?>
<FormGenerator
    xmlns:xsi="http://www.w3.org/2001/XMLSchema-instance" 
    xmlns="http://www.skien.de/FormGenerator"
    xsi:schemaLocation="http://www.skien.de/FormGenerator FormGenerator.xsd">
    <Form colwidth="25, 75">
        <Header text="Header" level="1"/>
        <Static text="Static" class="overview" for="strInput"/>
        <Div width="100">
            <FieldSet type="IMAGE" imageheight="20">
                <Line label="Test Line" for="strInput">
                    <Input name="strInput" size="100%" flags="MANDATORY" maxlength="100"/>
                </Line>
                <Line label="Test Line" for="btnTest">
                    <Button id="btnTest" text="Test" style="width: 50px;"/>
                </Line>
                <Line label="Test Line">
                    <Canvas id="canvasTest" width="200" height="200"/>
                </Line>
                <Line label="Test Line" for="bTest">
                    <Check name="bTest" btnvalue="set"/>
                </Line>
                <!--
                <Line label="Test Line">
                    <CKEdit name="strTest" rows="5" content-css="test.css" body-id="test_body_id"/>
                </Line>
                -->
                <Line label="Test Line">
                    <Color name="clrTest"/>
                </Line>
                <Line label="Test Line">
                    <Cur name="fltTest" size="10"/>
                </Line>
                <Line label="Test Line">
                    <Date name="dateTest" size="10"/>
                </Line>
                <Line label="Test Line">
                    <Float name="curTest" size="10" digits="3"/>
                </Line>
                <Line label="Test Line">
                    <Image name="imgTest" image="IMG_SEARCH" bindto="strTest" default="test.img"/>
                </Line>
                <Line label="CPU:">
                    <Meter name="fltTempCPU" width="100%" min="60" max="120.0" low="80.0" high="100.0" optimum="60.0"/>
                </Line>
                <Line label="GPU:">
                    <Meter name="fltTempGPU" width="100%" max="120.0" low="80.0" high="100.0"/>
                </Line>
                <Line label="Test Line">
                    <RadioGroup name="iTest">
                        <option value="0">zero</option>
                        <option value="1">one</option>
                    </RadioGroup>
                </Line>
                <Line label="Test Line">
                    <Range name="iTest" min="0" max="100" step="10"/>
                </Line>
                <Line label="Test Line">
                    <Select name="strGender" size="1" selectbtntext="Select" flags="SELECT_BTN"/>
                </Line>
                <Line label="Test Line">
                    <Select name="strSelect">
                        <option value="0">zero</option>
                        <option value="1">one</option>
                    </Select>
                </Line>
                <Line label="Your rating:">
                    <StarRate name="iRating">
                        <title>ungenÃ¼gend</title>
                        <title>mangelhaft</title>
                        <title>ausreichend</title>
                        <title>befriedigend</title>
                        <title>gut</title>
                        <title>sehr gut</title>
                    </StarRate>
                    <StarRate name="iRating1" submittitle="true"/>
                </Line>
                <Line label="Test Line">
                    <TextArea name="strTest" rows="5" cols="50"/>
                </Line>
                <Line label="Test Line">
                    <Int name="iInt" size="10"/>
                </Line>
                <Line label="Test Line">
                    <Time name="timeTest" size="10"/>
                </Line>
            </FieldSet>
        </Div>
        <ButtonBox buttons="SAVE DISCARD" flags="ALIGN_RIGHT"/>
        <Script>
            <![CDATA[
                function SelectImage()
                {
                    browseServer('strImage', 'imgImage', '/images');
                }
                function ResetImage()
                {
                    resetElement('imgImage');
                }
            ]]>
        </Script>
    </Form>
</FormGenerator>
